Arecaceae;Attalea;Attalea maripa;Accepted;Arecaceae;Attalea;maripa;Attalea maripa;;57;282;24,17;;40,74;18,1;5,88;;;20;;Yes;;;03° 25' N;61° 40' W;Amazon;Brazil;Dasyprocta leporina;Agouti;Visual observation;;;;;;;2003;"Silvius; Fragoso, 2003";"Silvius, K.M.; Fragoso, J.M.V. 2003. Red-rumped agouti (Dasyprocta leporina) home range use in an Amazonn forest: Implications for the aggregated distribution of forest trees. Biotropica 35(1), pp. 74-83."
Arecaceae;Astrocaryum;Astrocaryum murumuru;Accepted;Arecaceae;Astrocaryum;murumuru;Astrocaryum murumuru;Drupe;72,5;22,5;;;40;25;7,4;;;15;;Yes;;;11° 54' S;71° 19' W;Amazon;Peru;Dasyprocta variegata;Plant;;;x;x;;;;1997;Cintra & Horna (1997);"Cintra, R.; Horna, V. 1997 Seed and Seedling Survival of the Palm Astrocaryum Murumuru and the Legume Tree Dipteryx Micrantha in Gaps in Amazonian Forest Journal of Tropical Ecology"
Clusiaceae;Tovomita;Tovomita plumieri;Accepted;Clusiaceae;Tovomita;plumieri;Tovomita plumieri;;;;;;39;15;4,9;;;;;;;;15° 25' N;61° 20' W;;Dominica;Dasyprocta leporina;Agouti;;;;;;;;2010;Taylor et al., 2014;"Taylor, B.; Ickes, K.; DeWalt, S.J. 2014. Seed removal by an introduced scatter-hoarder on a Caribbean island. Caribbean Journal of Science, 48(1):9-17."
Arecaceae;Oenocarpus;Oenocarpus bataua;Accepted;Arecaceae;Oenocarpus;bataua;Oenocarpus bataua;;35;21,3;10,9;;36;;8,9;;;26;;Yes;3,39;53;6° 01' N;75° 08' W;Humid Tropical Forest;Colombia;Dasyprocta fuliginosa;Plant;Flagged line;;x;x;;;;2015;Franco-Quimbay et al., 2015;"Franco-Quimbay, July; Rojas-Robles, Rosario 2015 Frugivoria Y Dispersion De Semillas De La Palma Oenocarpus Bataua En Dos Regiones Con Diferente Estado De Conservacion Actualidades Biologicas"
Arecaceae;Oenocarpus;Oenocarpus bataua;Accepted;Arecaceae;Oenocarpus;bataua;Oenocarpus bataua;;35;21,3;10,9;;36;;8,9;;;26;;Yes;3,39;53;6° 51' N;75° 08' W;Humid Tropical Forest;Colombia;Dasyprocta punctata;Plant;Flagged line;;x;x;;;;2015;Franco-Quimbay et al., 2015;"Franco-Quimbay, July; Rojas-Robles, Rosario 2015 Frugivoria Y Dispersion De Semillas De La Palma Oenocarpus Bataua En Dos Regiones Con Diferente Estado De Conservacion Actualidades Biologicas"
Arecaceae;Oenocarpus;Oenocarpus bataua;Accepted;Arecaceae;Oenocarpus;bataua;Oenocarpus bataua;;35;21;11;;36;;8,9;;;26;;Yes;3,1;53;6° 45' N;75° 06' W;Humid Tropical Forest;Colombia;Dasyprocta punctata;Plant;Flagged line;10 meses;x;x;x;;x;2012;Rojas-Robles et al., 2012;"Rojas-Robles, R.; Gary Stiles, F.; Muñoz-Saba, Y. 2012. Frugivoría y dispersión de semillas de la palma Oenocarpus bataua (Arecaceae) en un bosque de los Andes colombianos. Revista de Biologia Tropical 60(4), pp. 1445-1461."
Arecaceae;Mauritia;Mauritia flexuosa;Accepted;Arecaceae;Mauritia;flexuosa;Mauritia flexuosa;Drupe;57,5;57,5;32,5;1;35;25;23,8;;;30;45;Yes;;;3° 56' N;69° 53' W;Amazon;Colombia;Dasyprocta fuliginosa;Plant;Exclosure;530 dias;x;x;;;;2016;"Acevedo-Quintero; Zamora-Abrego, 2016";"Acevedo-Quintero, J.F.; Zamora-Abrego, J.G. 2016. Papel de los mamíferos en los procesos de dispersión y depredación de semillas de Mauritia flexuosa (Arecaceae) en la Amazonía colombiana. Revista de Biología Tropical 64(1), pp. 5-15."
Arecaceae;Mauritia;Mauritia flexuosa;Accepted;Arecaceae;Mauritia;flexuosa;Mauritia flexuosa;Drupe;70;57,5;32,5;1;35;25;23,8;;;30;45;Yes;;;8° 23' N;65° 22' W;;Venezuela;Dasyprocta leporina;Plant;;;x;x;x;;;2002;Calderon & Elena,2002;Ponce Calderon, Maria Elena 2002 Patrones De Caida De Frutos En Mauritia Flexuosa L.F. Y Fauna Involucrada En Los Procesos De Remocion De Semillas Acta Botanica Venezuelica
Arecaceae;Mauritia;Mauritia flexuosa;Accepted;Arecaceae;Mauritia;flexuosa;Mauritia flexuosa;Drupe;57,5;57,5;32,5;1;35;25;23,8;;;30;45;Yes;;12,63;14° 55' S;64° 21' W;Amazon;Bolivia;Dasyprocta punctata;Rodents/Plant;Metal implants;;x;x (7,5%);;x;;2015;Mendieta-Aguilar et al., 2015;"Mendieta-Aguilar, G.; Pacheco, L.F.; Roldán, A.I. 2015. Dispersión de semillas de mauritia fexuosa (arecaceae) por frugívoros terrestres en Laguna azul, Beni, Bolivia. Acta Amazonica 45(1), pp. 45-56."
Arecaceae;Mauritia;Mauritia flexuosa;Accepted;Arecaceae;Mauritia;flexuosa;Mauritia flexuosa;Drupe;57,5;57,5;32,5;1;35;25;23,8;;;30;45;Yes;;;1° 06' S;75° 48' W;Amazon;Ecuador;Dasyprocta fuliginosa;Plant;;;x;x;;;;2016;Ojeda García (2016);Ojeda García, M. I. (2016). Dispersores primarios y secundarios de Oenocarpus bataua y Mauritia flexuosa en el bosque tropical Yasuní, Amazonía Ecuatoriana (Master's thesis, PUCE).
Fabaceae;Swartzia;Swartzia caribaea;Accepted;Leguminosae;Swartzia;caribaea;Swartzia caribaea;;;;;;34;25;11,13;;;15;;;;;15° 25' N;61° 20' W;;Dominica;Dasyprocta leporina;Agouti;Gaiola de exclusão (tirar efeito da cutia);;;;;;;2014;Taylor et al., 2014;"Taylor, B.; Ickes, K.; DeWalt, S.J. 2014. Seed removal by an introduced scatter-hoarder on a Caribbean island. Caribbean Journal of Science, 48(1):9-17."
Arecaceae;Astrocaryum;Astrocaryum aculeatum;Accepted;Arecaceae;Astrocaryum;aculeatum;Astrocaryum aculeatum;;35;18;;;30;15;14,9;;;15;12;Yes;;;02° 50' S;59° 59' W;Amazon;Brazil;Dasyprocta leporina;;;;;;;;;2011;Ferreira (2011);Ferreira, A. P. P. (2011). Composição da comunidade de palmeiras (arecaceae) e remoção de frutos de Attalea attaleoides (BARB. RODR.) WESS. BOER E Astrocaryum gynacanthum MART. em uma floresta de terra-firme na amazônia central.
Fabaceae;Mucuna;Mucuna urens;Accepted;Leguminosae;Mucuna;urens;Mucuna urens;;;;;;28;28;5,04;;;30;;;9,06;35,9;27° 42' S;48° 30' W;Atlantic Forest;Brazil;Dasyprocta azarae;Plant;Spool and line;;x;x (48%);x (36%);;;2012;Zimmermann et al., 2012;"Zimmermann, T.G.; Begnini, R.M.; Castellani, T.T.; Lopes, B.C.; Reis, A. 2012. Consumo e dispersão secundária de sementes de Mucuna urens (Fabaceae) em Floresta Atlântica no Sul do Brasil. Rodriguésia 63(4), pp. 1139-1145."
Arecaceae;Astrocaryum;Astrocaryum standleyanum;Accepted;Arecaceae;Astrocaryum;standleyanum;Astrocaryum standleyanum;Drupe;55;40;;;20;15;7,56;;;17;;Yes;;;9° 10' N;79° 51' W;Humid Tropical Forest e semidecídua de vários estágios sucessionais;Panama;Dasyprocta punctata;Agouti;Captura/ Seed radiotrack;;x;x;;;;2008;Aliaga-Rossel et al., 2008;"Aliaga-Rossel, E.; Kays, R.W.; Fragoso, J.M.V. 2008. Home-range use by the Central American agouti (Dasyprocta punctata) on Barro Colorado Island, Panama. Journal of Tropical Ecology 24(4), pp. 367-374."
Arecaceae;Astrocaryum;Astrocaryum standleyanum;Accepted;Arecaceae;Astrocaryum;standleyanum;Astrocaryum standleyanum;Drupe;55;40;;;20;15;7,56;;;17;;Yes;;;9° 10' N;79° 51' W;Lowland Rain Forest;Panama;Dasyprocta punctata;Mammals / Fragmentation;;;x;x;x;;x;2005;"Asquith; Mejia-Chang, 2005";"Asquith, N.M.; Mejia-Chang, M. 2005. Mammals, edge effects, and the loss of tropical forest diversity. Ecology, 86(2), pp. 379-390."
Arecaceae;Astrocaryum;Astrocaryum standleyanum;Accepted;Arecaceae;Astrocaryum;standleyanum;Astrocaryum standleyanum;Drupe;55;40;;;20;15;7,56;;;17;;Yes;;;9° 10' N;79° 51' W;;Panama;Dasyprocta punctata;;;;x;x;;;;2015;Dittel et al., 2015;"Dittel, Jacob W.; Lambert, Thomas D.; Adler, Gregory H. 2015 Seed Dispersal by Rodents in A Lowland Forest in Central Panama Journal of Tropical Ecology"
Arecaceae;Astrocaryum;Astrocaryum standleyanum;Accepted;Arecaceae;Astrocaryum;standleyanum;Astrocaryum standleyanum;Drupe;55;40;;;20;15;7,56;;;17;;Yes;;;9° 10' N;79° 51' W;Humid Tropical Forest;Panama;Dasyprocta punctata;Agouti;;1 ano 7 meses;x;x;;;;2013;Emsens et al., 2013;"Emsens, W.-J.; Suselbeek, L.; Hirsch, B.T.; Kays, R.; Winkelhagen, A.J.S.; Jansen, P.A. 2013. Effects of Food Availability on Space and Refuge Use by a Neotropical Scatterhoarding Rodent. Biotropica 45(1), pp. 88-93."
Arecaceae;Astrocaryum;Astrocaryum standleyanum;Accepted;Arecaceae;Astrocaryum;standleyanum;Astrocaryum standleyanum;Drupe;55;40;;;20;15;7,56;;;17;;Yes;;;9° 10' N;79° 51' W;Humid Tropical Forest;Panama;Dasyprocta punctata;Rodents/Plant;Visual observation/Line;6 meses;x;x;;;x;1993;Forget, 1993;Forget, P.-M. 1993. Post-dispersal predation and scatterhoarding of Dipteryx panamensis (Papilionaceae) seeds by rodents in Panama. Oecologia 94(2), pp. 255-261.
Arecaceae;Astrocaryum;Astrocaryum standleyanum;Accepted;Arecaceae;Astrocaryum;standleyanum;Astrocaryum standleyanum;Drupe;55;40;;;20;15;7,56;;;17;;Yes;7;19;9° 10' N;79° 51' W;Humid Tropical Forest;Panama;Dasyprocta punctata;Agouti;Flagged line;;x;x;x;;;2009;Gálvez et al., 2009;"Gálvez, D.; Kranstauber, B.; Kays, R.W.; Jansen, P.A. 2009. Scatter hoarding by the Central American agouti: a test of optimal cache spacing theory. Animal Behaviour 78(6), pp. 1327-1333."
Arecaceae;Astrocaryum;Astrocaryum standleyanum;Accepted;Arecaceae;Astrocaryum;standleyanum;Astrocaryum standleyanum;Drupe;55;40;;;20;15;7,56;;;17;;Yes;;;9° 10' N;79° 51' W;Humid Tropical Forest;Panama;Dasyprocta punctata;Plant / Animals;;;;;;;;2015;Garzon-Lopes et al., 2015;"Garzon-Lopez, Carol X.; Ballesteros-Mejia, Liliana; Ordonez, Alejandro; Bohlman, Stephanie A.; Olff, Han; Jansen, Patrick A. 2015 Indirect Interactions Among Tropical Tree Species Through Shared Rodent Seed Predators: A Novel Mechanism of Tree Species Coexistence Ecology Letters"
Arecaceae;Astrocaryum;Astrocaryum standleyanum;Accepted;Arecaceae;Astrocaryum;standleyanum;Astrocaryum standleyanum;Drupe;55;40;;;20;15;7,56;;;17;;Yes;;241;9° 10' N;79° 51' W;Humid Tropical Forest;Panama;Dasyprocta punctata;Methodology/Agouti;Seed radiotrack;Anos 2006, 2009, 2010;x;x;x;x;;2012;Hirsch et al., 2012a;"Hirsch, B.T.; Kays, R.; Jansen, P.A. 2012a. A telemetric thread tag for tracking seed dispersal by scatter-hoarding rodents. Plant Ecology 213(6), pp. 933-943."
Arecaceae;Astrocaryum;Astrocaryum standleyanum;Accepted;Arecaceae;Astrocaryum;standleyanum;Astrocaryum standleyanum;Drupe;55;40;;;20;15;7,56;;;17;;Yes;55;280;9° 10' N;79° 51' W;Humid Tropical Forest;Panama;Dasyprocta punctata;Agouti/Plant;Seed radiotrack;;x;x;x;x;;2012;Hirsch et al., 2012b;"Hirsch, B.T.; Kays, R.; Pereira, V.E.; Jansen, P.A. 2012. Directed seed dispersal towards areas with low conspecific tree density by a scatter-hoarding rodent. Ecology Letters 15(12), pp. 1423-1429."
Arecaceae;Astrocaryum;Astrocaryum standleyanum;Accepted;Arecaceae;Astrocaryum;standleyanum;Astrocaryum standleyanum;Drupe;55;40;;;20;15;7,56;;;17;;Yes;;;9° 10' N;79° 51' W;Humid Tropical Forest;Panama;Dasyprocta punctata;Agouti;Seed radiotrack;;;;x;;;2013;Hirsch et al., 2013;"Hirsch, B.T.; Kays, R.; Jansen, P.A. 2013. Evidence for cache surveillance by a scatter-hoarding rodent. Animal Behaviour 85(6), pp. 1511-1516."
Arecaceae;Astrocaryum;Astrocaryum standleyanum;Accepted;Arecaceae;Astrocaryum;standleyanum;Astrocaryum standleyanum;Drupe;55;40;;;20;15;7,56;;;17;;Yes;;;9° 10' N;79° 51' W;Humid Tropical Forest;Panama;Dasyprocta punctata;Agouti/Plant;;;x;x;x;;;2010;Jansen et al., 2010;"Jansen, P.A.; Elschot, K.; Verkerk, P.J.; Wright, S.J. 2010. Seed predation and defleshing in the agouti-dispersed palm Astrocaryum standleyanum. Journal of Tropical Ecology 26(5), pp. 473-480."
Arecaceae;Astrocaryum;Astrocaryum standleyanum;Accepted;Arecaceae;Astrocaryum;standleyanum;Astrocaryum standleyanum;Drupe;55;40;;;20;15;7,56;;;17;;Yes;54,9;280;9° 10' N;79° 51' W;Humid Tropical Forest;Panama;Dasyprocta punctata;Agouti;Seed radiotrack;;x;x;x (88%);;;2012;Jansen et al., 2012;"Jansen, P.A.; Hirsch, B.T.; Emsens, W.-J.; Zamora-Gutierrez, V.; Wikelski, M.; Kays, R. 2012. Thieving rodents as substitute dispersers of megafaunal seeds. Proceedings of the National Academy of Sciences of the United States of America 109(31), pp. 12610-12615."
Arecaceae;Astrocaryum;Astrocaryum standleyanum;Accepted;Arecaceae;Astrocaryum;standleyanum;Astrocaryum standleyanum;Drupe;55;40;;;20;15;7,56;;;17;;Yes;;;9° 10' N;79° 51' W;;Panama;Dasyprocta punctata;Dispersão geral do local;;;x;x;x;;;1970;Smythe, 1970;Smythe, N. 1970. Relationships between fruiting seasons and seed dispersal methods in a Neotropical Forest. The American Naturalist 104(935), pp. 25-35.
Arecaceae;Astrocaryum;Astrocaryum standleyanum;Accepted;Arecaceae;Astrocaryum;standleyanum;Astrocaryum standleyanum;Drupe;55;40;;;20;15;7,56;;;17;;Yes;;;9° 10' N;79° 51' W;;Panama;Dasyprocta punctata;Plant;;11 meses;x;x;x;x;;1989;Smythe, 1989;Smythe, N. 1989. Seed survival in the palm Astrocaryum standleyanum: evidence for dependence upon its seed dispersers. Biotropica 21(1), pp. 50-56.
Arecaceae;Astrocaryum;Astrocaryum standleyanum;Accepted;Arecaceae;Astrocaryum;standleyanum;Astrocaryum standleyanum;Drupe;55;40;;;20;15;7,56;;;17;;Yes;;;9° 10' N;79° 51' W;Lowland Rain Forest;Panama;Dasyprocta punctata;Hunt;;;x;x;;;;2000;Wright et al., 2000;"Wright, S.J.; Zeballos, H.; Domínguez, I.; Gallardo, M.M.; Moreno, M.C.; Ibáñez, R. 2000. Poachers alter mammal abundance, seed dispersal, and seed predation in a Neotropical Forest. Conservation Biology 14(1), pp. 227-239."
Arecaceae;Livistona;Livistona chinensis;Accepted;Arecaceae;Livistona;chinensis;Livistona chinensis;;30;28;;;16;10;1,14;;;35;;;;;23° 27' S;45° 02' W;Atlantic Forest;Brazil;Dasyprocta leporina;Agouti;Line / Visual observation;;x;x;x;;;2010;Galetti et al., 2010;"Galetti, M.; Donatti, C.I.; Steffler, C.; Genini, J.; Bovendorp, R.S.; Fleury, M. 2010. The role of seed mass on the caching decision by agoutis, Dasyprocta leporina (Rodentia: Agoutidae). Zoologia 27(3), pp. 472-476."
Arecaceae;Syagrus;Syagrus pseudococos;Accepted;Arecaceae;Syagrus;pseudococos;Syagrus pseudococos;Drupe;65;40;33,3;;15;15;19,09;;;15;;Yes;;;23° 27' S;45° 02' W;Atlantic Forest;Brazil;Dasyprocta leporina;Agouti;Line/Visual observation;;x;x;x;;;2010;Galetti et al., 2010;"Galetti, M.; Donatti, C.I.; Steffler, C.; Genini, J.; Bovendorp, R.S.; Fleury, M. 2010. The role of seed mass on the caching decision by agoutis, Dasyprocta leporina (Rodentia: Agoutidae). Zoologia 27(3), pp. 472-476."
Arecaceae;Syagrus;Syagrus pseudococos;Accepted;Arecaceae;Syagrus;pseudococos;Syagrus pseudococos;Drupe;65;40;33,3;;15;15;19,09;;;15;;Yes;;;23° 31' S;45° 02' W;Atlantic Forest;Brazil;Dasyprocta leporina;;;;x;x;;;;2009;Genin et al., 2009;"Genini, Julieta; Galetti, Mauro; Morellato, L. Patricia C. 2009 Fruiting Phenology of Palms and Trees in An Atlantic Rainforest Land-bridge Island Flora"
Annonaceae;Cymbopetalum ;Cymbopetalum baillonii;Accepted;Annonaceae;Cymbopetalum;baillonii;Cymbopetalum baillonii;;;;;;15;;0,33;;;25;;;;;18° 35' N;95° 04' W;Evergreen Lowland Rainforest;Mexico;Dasyprocta mexicana;;;;;;;;;1998;Sánchez-Cordeiro & Martinéz-Galhardo, 1998;SÁNCHEZ-CORDERO, V., & MARTÍNEZ-GALLARDO, R. (1998). Postdispersal fruit and seed removal by forest-dwelling rodents in a lowland rainforest in Mexico. Journal of Tropical Ecology, 14(2), 139-151. doi:10.1017/S0266467498000121
Arecaceae;Bactris;Bactris acanthocarpa;Accepted;Arecaceae;Bactris;acanthocarpa;Bactris acanthocarpa;;18;15;;;14;14;2;;;6;;No;4;5,3;8° 00' S;35° 00' W;Atlantic Forest;Brazil;Dasyprocta prymnolopha;Plant;Flagged line;2 anos;x;x;x;x;;2001;"Silva; Tabarelli, 2001";"Silva, M.G.; Tabarelli, M. 2001. Seed dispersal, plant recruitment and spatial distribution of Bactris acanthocarpa Martius (Arecaceae) in a remnant of Atlantic forest in northeast Brazil. Acta Oecologica 22(5-6), pp. 259-268."
Arecaceae;Bactris;Bactris setosa;Accepted;Arecaceae;Bactris;setosa;Bactris setosa;;17,5;12,5;2,7;1;14;7,2;1,4;;;6;;No;;;23° 31' S;45° 02' W;Atlantic Forest;Brazil;Dasyprocta leporina;;;;x;x;;;;2009;Genin et al., 2009;"Genini, Julieta; Galetti, Mauro; Morellato, L. Patricia C. 2009 Fruiting Phenology of Palms and Trees in An Atlantic Rainforest Land-bridge Island Flora"
Arecaceae;Attalea;Attalea humilis;Accepted;Arecaceae;Attalea;humilis;Attalea humilis;;65;60;;;;;51,4;;;;0;Yes;;;23° 31' S;45° 02' W;Atlantic Forest;Brazil;Dasyprocta leporina;;;;x;x;;;;2009;Genin et al., 2009;"Genini, Julieta; Galetti, Mauro; Morellato, L. Patricia C. 2009 Fruiting Phenology of Palms and Trees in An Atlantic Rainforest Land-bridge Island Flora"
Arecaceae;Attalea;Attalea geraensis;Accepted;Arecaceae;Attalea;geraensis;Attalea geraensis;;44;27;19,9;;;;19,9;;;;0;Yes;6,5;30;21° 33' S;47° 45' W;Cerrado;Brazil;Dasyprocta azarae;Plant;Spool and line;1 ano;x;x;x;;;2007;"Almeida; Galetti, 2007";"Almeida, L.B.; Galetti, M. 2007. Seed dispersal and spatial distribution of Attalea geraensis (Arecaceae) in two remnants of Cerrado in Southeastern Brazil. Acta Oecologica 32(2), pp. 180-187."
Arecaceae;Astrocaryum;Astrocaryum sciophilum;Accepted;Arecaceae;Astrocaryum;sciophilum;Astrocaryum sciophilum;;65;32,5;;;;;14,5;;;14;15;Yes;;;4° 02' N;52° 42' W;;French Guiana;Dasyprocta leporina;Plant;;;x;x;x;;;2003;Charles-Dominque et al., 2003;"Charles-Dominique, P.; Chave, J.; Dubois, M. A.; De Granville, J. J.; Riera, B.; Vezzoli, C. 2003 Colonization Front of the Understorey Palm Astrocaryum Sciophilum in A Pristine Rain Forest of French Guiana Global Ecology and Biogeography"
Arecaceae;Attalea;Attalea attaleoides;Accepted;Arecaceae;Attalea;attaleoides;Attalea attaleoides;;50;25;;2;;;12;;;;;Yes;;;02° 50' S;59° 59' W;Amazon;Brazil;Dasyprocta leporina;;;;;;;;;2012;de Freitas et al., 2012;"de Freitas, Cintia Gomes; Capellotto Costa, Flavia Regina; Svenning, Jens-Christian; Balslev, Henrik 2012 Topographic Separation of Two Sympatric Palms in the Central Amazon - Does Dispersal Play A Role? Acta Oecologica-International Journal of Ecology"
Arecaceae;Astrocaryum;Astrocaryum paramaca;Accepted;Arecaceae;Astrocaryum;paramaca;Astrocaryum paramaca;;37,5;22,5;;;;;5;;;8;11;;;;;;;;Dasyprocta sp.;;;;x;x;;;;1991;Forget, 1991b;Forget, P.-M. 1991. Scatterhoarding of Astrocaryum paramaca by Proechimys in French Guiana: comparison with Myoprocta exilis. Trop. Ecol. 32: 155-167.
Arecaceae;Attalea;Attalea funifera;Accepted;Arecaceae;Attalea;funifera;Attalea funifera;;125;60;;;;;4,9;;;15;30;;;;14° 47' S;39° 02' W;Atlantic Forest;Brazil;Dasyprocta leporina;Plant;;;;;;;;2002;Voeks (2002);Voeks, Robert A. “Reproductive Ecology of the Piassava Palm (Attalea Funifera) of Bahia, Brazil.” Journal of Tropical Ecology, vol. 18, no. 1, 2002, pp. 121–136
Fagaceae;Quercus;Quercus humboldtii;Accepted;Fagaceae;Quercus;humboldtii;Quercus humboldtii;;;;;;;;4,38;;;;;;;;06° 05' N;73° 07' W;Humid Tropical Forest;Colombia;Dasyprocta punctata;Plant;;;x;x;;;;2010;Guerrero-Rodriguez et al. (2010);Guerrero-Rodríguez, S. B., Paz-Camacho, E. A., & Rosselli, Á. P. (2010). Efecto de la intervención antrópica en la distribución de las semillas y plántulas del roble (Quercus humboldtii Bonpl., Fagaceae) en la cordillera oriental colombiana. Colombia Forestal, 13(1), 163-180.
Fabaceae;Dioclea;Dioclea reflexa;Accepted;Leguminosae;Dioclea;reflexa;Dioclea reflexa;;;;;;;;4,01;;;;;;;;10° 26' N;84° 00' W;;Costa Rica;Dasyprocta punctata;Plant;Removal observation;;;;;;;2007;Peterson, 2007;Peterson, M. Seed toughness in Persea americana (Lauraceae) and Dioclea reflexa (Papilionaceae) and feeding behavior in agoutis (Dasyprocta punctata).
Celastraceae;Salacia;Salacia elliptica;Accepted;Celastraceae;Salacia;elliptica;Salacia elliptica;;;;;;;;2,32;;;;;;;;19° 34' S;56° 14' W;Pantanal;Brazil;Dasyprocta azarae;Interaction;;;;;;;;2011;Donatti et al. (2011);Donatti, C. I., Guimarães, P. R., Galetti, M., Pizo, M. A., Marquitti, F. M., & Dirzo, R. (2011). Analysis of a hyper?diverse seed dispersal network: modularity and underlying mechanisms. Ecology letters, 14(8), 773-781.
Celastraceae;Hylenaea;Hylenaea praecelsa;Accepted;Celastraceae;Hylenaea;praecelsa;Hylenaea praecelsa;;;;;;;;2,07;;;;;;;;9° 10' N;79° 51' W;Humid Tropical Forest;Panama;Dasyprocta punctata;Rodents/Plant;Visual observation / Line;6 meses;x;x;;;x;1993;Forget, 1993;Forget, P.-M. 1993. Post-dispersal predation and scatterhoarding of Dipteryx panamensis (Papilionaceae) seeds by rodents in Panama. Oecologia 94(2), pp. 255-261.
Arecaceae;Bactris;Bactris gasipaes;Accepted;Arecaceae;Bactris;gasipaes;Bactris gasipaes;;50;40;;;;;1,38;;;20;;;;;10° 18' N;84° 48' W;;Costa Rica;Dasyprocta punctata;Plant;;;;;;;;2008;Dale, 2008;Dale, J. The role of L-dopa in Mucuna fruits: a deterrent or a marker.
Olacaceae;Dulacia;Dulacia egleri;Accepted;Olacaceae;Dulacia;egleri;Dulacia egleri;;;;;;;;1,2;;;;;No;;;19° 34' S;56° 14' W;Pantanal;Brazil;Dasyprocta azarae;Interaction;;;;;;;;2011;Donatti et al. (2011);Donatti, C. I., Guimarães, P. R., Galetti, M., Pizo, M. A., Marquitti, F. M., & Dirzo, R. (2011). Analysis of a hyper?diverse seed dispersal network: modularity and underlying mechanisms. Ecology letters, 14(8), 773-781.
Arecaceae;Astrocaryum;Astrocaryum malybo;Accepted;Arecaceae;Astrocaryum;malybo;Astrocaryum malybo;;;;;;;;;;;5;;;;;8° 25' N;76° 03' W;;Colombia;Dasyprocta punctata;Plant / Animals;Camera traps;;;;;;;2018;Acevedo-Quintero et al. 2018;Acevedo-Quintero, J. F., Zamora-Abrego, J. G., & Ortega-León, Á. M. (2018). The prickles of Astrocaryum malybo as a structural defense to avoid seed predation. Food Webs, 16, e00088
Arecaceae;Astrocaryum;Astrocaryum gratum;Accepted;Arecaceae;Astrocaryum;gratum;Astrocaryum gratum;;53;35;;1;;;;;;15;;;;;13° 20' S;68° 10' W;Humid Tropical Forest e semidecídua de vários estágios sucessionais;Bolivia;Dasyprocta punctata;Plant;Exclosure;;x;x;;;;2015;Aliaga et al., 2015;"Aliaga-Rossel, Enzo; Fragoso, Jose Manuel 2015 Defaunation Affects Astrocaryum Gratum (arecales: Arecaceae) Seed Survivorship in A Sub-montane Tropical Forest Revista De Biologia Tropical"
Arecaceae;Attalea;Attalea rostrata;Accepted;Arecaceae;Attalea;rostrata;Attalea rostrata;;;;;;;;;;;1,5;48;;;;;;;Costa Rica;Dasyprocta punctata;;;;x;x;;;;1994;Bradford & Smith 1997;Bradford, D. F., & Smith, C. C. (1977). Seed predation and seed number in Scheelea palm fruits. Ecology, 58(3), 667-673.
Arecaceae;Copernicia;Copernicia alba;Accepted;Arecaceae;Copernicia;alba;Copernicia alba;;;;;;;;;;;;;;;;18° 59' S;56° 39' W;Pantanal;Brazil;Dasyprocta azarae;Agouti;;;;;;;;2013;Cid et al., 2013;"Cid, Bruno; Oliveira-Santos, Luiz Gustavo R.; Mourao, Guilherme 2013 Seasonal Habitat Use of Agoutis (dasyprocta Azarae) Is Driven by the Palm Attalea Phalerata in Brazilian Pantanal Biotropica"
Myrtaceae;Myrciaria;Myrciaria sp.;Genus-level;Myrtaceae;Myrciaria;sp.;Myrciaria sp.;;;;;;;;;;;;;;;;22° 55' S;43° 11' W;Atlantic Forest;Brazil;Dasyprocta leporina;Agouti;Visual observation;;x;;;;;2014;Cid et al., 2014;"Cid, B.; Figueira, L.; Mello, A.F.T.; Pires, A.S.; Fernandez, F.A.S. 2014. Short-term success in the reintroduction of the red-humped agouti Dasyprocta leporina, an important seed disperser, in a Brazilian Atlantic Forest reserve. Tropical Conservation Science 7(4), pp. 796-810."
;Carapa;Carapa guianensis;Accepted;Meliaceae;Carapa;guianensis;Carapa guianensis;;;;;;;;;;;;;;;;1° 59' N;59° 43' W;Amazon;Guyana;Dasyprocta leporina;Plants;;;;;;;;2018;Cummings et al., 2018;Cummings, A. R., Read, J. M., & Fragoso, J. M. (2018). Implications of forest type and land tenure diversity for the sustainability of ecosystem services provided by northern Amazonia’s multiple-use tree species. Landscape ecology, 33(3), 423-438.
;Protium;Protium decandrum;Accepted;Burseraceae;Protium;decandrum;Protium decandrum;;;;;;;;;;;30;;;;;1° 59' N;59° 43' W;Amazon;Guyana;Dasyprocta leporina;Plants;;;;;;;;2018;Cummings et al., 2018;Cummings, A. R., Read, J. M., & Fragoso, J. M. (2018). Implications of forest type and land tenure diversity for the sustainability of ecosystem services provided by northern Amazonia’s multiple-use tree species. Landscape ecology, 33(3), 423-438.
Arecaceae;Phytelephas;Phytelephas seemannii;Accepted;Arecaceae;Phytelephas;seemannii;Phytelephas seemannii;;80;140;;;;;;;;4;30;Yes;;;;;;Panama;Dasyprocta punctata;Plant;;;;;;;;1996;Dalling et al. (1996);Dalling, J. W., Harms, K. E., Eberhard, J. R., & Candanedo, I. (1996). Natural history and uses of tagua (Phytelephas seemannii) in Panamá. Principes, 40, 16-23
Arecaceae;Attalea;Attalea microcarpa;Accepted;Arecaceae;Attalea;microcarpa;Attalea microcarpa;;37,5;25;;;;;;;;;;;;;02° 50' S;59° 59' W;Amazon;Brazil;Dasyprocta leporina;;;;;;;;;2012;de Freitas et al., 2012;"de Freitas, Cintia Gomes; Capellotto Costa, Flavia Regina; Svenning, Jens-Christian; Balslev, Henrik 2012 Topographic Separation of Two Sympatric Palms in the Central Amazon - Does Dispersal Play A Role? Acta Oecologica-International Journal of Ecology"
Arecaceae;Attalea;Attalea rostrata;Accepted;Arecaceae;Attalea;rostrata;Attalea rostrata;;;;;;;;;;;1,5;48;;4;;9° 10' N;79° 51' W;Humid Tropical Forest;Panama;Dasyprocta punctata;Rodents/Plant;Flagged line;;x;x;x;;;1994;Forget et al., 1994 ;"Forget, P.-M.; Munoz, E.; Leigh Jr, E.G. 1994. Predation by rodents and bruchid beetles on seeds of Scheelea palms on Barro Colorado Island, Panama. Biotropica 26(4), pp. 420-426."
Arecaceae;Attalea;Attalea rostrata;Accepted;Arecaceae;Attalea;rostrata;Attalea rostrata;;;;;;;;;;;1,5;48;;;;9° 10' N;79° 51' W;Humid Tropical Forest;Panama;Dasyprocta punctata;Rodents/Plant;Bite marks on seeds /Visual observation / Line;6 meses;x;x;;;x;1993;Forget, 1993;Forget, P.-M. 1993. Post-dispersal predation and scatterhoarding of Dipteryx panamensis (Papilionaceae) seeds by rodents in Panama. Oecologia 94(2), pp. 255-261.
Arecaceae;Astrocaryum;Astrocaryum chambira;Accepted;Arecaceae;Astrocaryum;chambira;Astrocaryum chambira;;70;47,5;;;;;;;;30;;;8,6;;0° 49' S;70° 13' W;Humid Tropical Forest;Colombia;Dasyprocta fuliginosa;;Flagged line;70 days;x;x;x;;;2009;Ramirez et al., 2009;"Ramirez, Beatriz H.; Parrado-Rosselli, Angela; Stevenson, Pablo 2009 Seed Dispersal of A Useful Palm (astrocaryum Chambira Burret) in Three Amazonian Forests With Different Human Intervention Colombia Forestal"
